,Final_matn,matn_length,chapter_no,chapter,level
2172,يسر سفر عمر خطب يسر معه ليل سأل عمر خطب شىء فلم يجب سأل فلم يجب سأل فلم يجب عمر خطب ثكل عمر نزر رات يجب عمر فحر بعر قدم ناس وخش نزل قرآ فما نشب صرخ صرخ فقل خشت يكون نزل قرآ فجئ سلم زلت ليل سور لهي احب طلع شمس قرأ فتح فتح مبي,576,65,Prophetic Commentary on the Qur'an (Tafseer of the Prophet (pbuh)) - كتاب التفسير,صعب
2173,وئل سأل كنا بصف رجل الم تر يدع كتب علي سهل حنف تهم نفس لقد رأت يوم حدب يعن صلح نبي شرك نرى قتل قتل فجء عمر الس لحق وهم بطل الس قتل جنة قتل نار ففم اعط دنة دين رجع ولم حكم بين خطب ولن يضع رجع تغظ فلم صبر جاء بكر بكر الس لحق وهم بطل خطب ولن يضع نزل سور فتح,637,65,Prophetic Commentary on the Qur'an (Tafseer of the Prophet (pbuh)) - كتاب التفسير,صعب
2174,لعن وشم وشم تنمص تفلج حسن غير خلق بلغ مرأ بني اسد يقل عقب فجء فقل بلغ انك لعن وكت الع لعن كتب فقل قرأ لوح فما وجد تقل كنت قرأ وجد قرأ اتا رسل خذو نها فنت فإن نهى فإن اهل علو ذهب نظر ذهب نظر فلم تر حجت شيئ جمع,542,65,Prophetic Commentary on the Qur'an (Tafseer of the Prophet (pbuh)) - كتاب التفسير,صعب
2175,اتى رجل اصب جهد أرسل نسه فلم يجد عند شيئ رجل يضف ليل رحم فقم رجل صار ذهب اهل مرأ ضيف دخر شيئ ولل عند قوت صبة ارد صبة عشء فنم على أطفئ سرج نطو بطن ليل فعل رجل عجب عز وجل ضحك وفل أنزل عز وجل ؤثر نفس خصص,595,65,Prophetic Commentary on the Qur'an (Tafseer of the Prophet (pbuh)) - كتاب التفسير,صعب
2176,محن هجر اله ؤمن بهذ اية بقل نبي جءك ؤمن بيع قول غفر رحم عرة عئش اقر بهذا شرط ؤمن بيع كلا ولل مست يده يد مرأ باع بيع بقل بيع,371,65,Prophetic Commentary on the Qur'an (Tafseer of the Prophet (pbuh)) - كتاب التفسير,صعب
2177,شهد صلة يوم فطر وأب بكر عمر عثم فكل يصل خطب خطب نزل نبي فكأ نظر اله جلس رجل بيد يشق اتى نسء بلل نبي جءك ؤمن بيع يشر بلل شيئ سرق يزن قلن ولد يأت ببه فري ايد أرجل فرغ اية كله فرغ وقل مرأ وحد يجب غير يدر حسن صدق بسط بلل ثوب جعل يلق فتخ خواتيم ثوب بلل,590,65,Prophetic Commentary on the Qur'an (Tafseer of the Prophet (pbuh)) - كتاب التفسير,صعب
2178,كنت غزة سمع عبد ابى نفق نفض حول رجع عند خرج اعز اذل ذكر لعم ذكر نبي فدع حدث أرسل عبد ابى أصحاب حلف قال كذب صدق أصب يصب ثله جلس بيت عمي ارد كذب ومق أنزل على جءك نفق بعث نبي قرأ صدق زيد,557,65,Prophetic Commentary on the Qur'an (Tafseer of the Prophet (pbuh)) - كتاب التفسير,صعب
2179,كنت عمي سمع عبد ابى سلل نفق نفض وقل رجع دين خرج اعز اذل ذكر لعم ذكر عمي رسل أرسل عبد ابى أصحاب حلف قال صدق كذب أصب يصب ثله جلس بيت أنزل عز وجل جءك نفق قول يقل نفق قول خرج اعز اذل أرسل قرأ صدق,598,65,Prophetic Commentary on the Qur'an (Tafseer of the Prophet (pbuh)) - كتاب التفسير,صعب
2180,خرج نبي سفر اصب ناس شدة عبد ابى أصحاب نفق نفض حول وقل رجع دين خرج اعز اذل فأت نبي أخبر أرسل عبد ابى سأل جهد يمن فعل قال كذب زيد وقع نفس قال شدة نزل عز وجل صدق جءك نفق فدع نبي غفر فلو رءس وقل خشب سند كان رجل جمل شىء,526,65,Prophetic Commentary on the Qur'an (Tafseer of the Prophet (pbuh)) - كتاب التفسير,صعب
2181,عبد ابى سلل نفق نفض ولئ رجع دين خرج اعز اذل ذكر لعم ذكر عمي نبي فدع حدث أرسل عبد ابى أصحاب حلف قال كذب نبي صدق أصب غم يصب ثله جلس بيت وقل عمي ارد كذب نبي ومق أنزل على جءك نفق قال شهد انك رسل أرسل نبي قرأ وقل صدق,538,65,Prophetic Commentary on the Qur'an (Tafseer of the Prophet (pbuh)) - كتاب التفسير,صعب
2182,كنا غزة سفي مرة جيش كسع رجل هجر رجل صار صار صار وقل هجر هجر سمع بال دعى جهل قال كسع رجل هجر رجل صار دعو فإن نتن سمع بذل عبد ابى علو ولل رجع دين خرج اعز اذل بلغ نبي فقم عمر دعن ضرب عنق نفق نبي دعه حدث ناس حمد قتل صحب وكانت صار هجر قدم دين هجر كثر سفي حفظ عمرو عمرو جبر كنا نبي,713,65,Prophetic Commentary on the Qur'an (Tafseer of the Prophet (pbuh)) - كتاب التفسير,صعب
2183,كنا غزة كسع رجل هجر رجل صار صار صار وقل هجر هجر سمع رسل فقل كسع رجل هجر رجل صار صار صار وقل هجر ياللمهاجر نبي دعو فإن نتن جبر وكانت صار قدم نبي كثر هجر عبد ابى وقد فعل ولل رجع دين خرج اعز اذل عمر خطب دعن ضرب عنق نفق نبي دعه حدث ناس حمد قتل صحب,652,65,Prophetic Commentary on the Qur'an (Tafseer of the Prophet (pbuh)) - كتاب التفسير,صعب
2184,كنت حلق عبد رحم ابي يلى صحب عظمو ذكر اخر اجل حدث حدث سبع حرث عبد عتب ضمز صحب حمد ففط فقل جرء كذب عبد عتب نحي كوف ستح وقل عمه يقل فلق عطة الك عمر سأل ذهب حدث حدث سبع فقل عبد شيئ كنا عبد جعل عليها غلظ جعل عليها رخص نزل سور نسء قصرى طولى وأل حمل اجل يضع حمل,525,65,Prophetic Commentary on the Qur'an (Tafseer of the Prophet (pbuh)) - كتاب التفسير,صعب
2185,سأل سلم عبد رحم نزل قرآ دثر يقل قرأ بسم ربك خلق سلم سأل جبر عبد وقل جبر حدث جور حرء فلم قضت جري هبط فند نظر يمي فلم ار شيئ نظر شمل فلم ار شيئ نظر ممي فلم ار شيئ نظر خلف فلم ار شيئ رفع رأس فرأ شيئ فأت خدج فقل دثرو وصب ماء برد دثرو وصب ماء برد نزل دثر قم أنذر ورب كبر,575,65,Prophetic Commentary on the Qur'an (Tafseer of the Prophet (pbuh)) - كتاب التفسير,صعب
2186,كنا جنز بقع غرقد فأت قعد قعد حول ومع خصر نكس جعل ينك خصر نكم نفس كتب كان جنة نار وإل كتب شقة سعد رجل افل تكل كتب ندع عمل منا اهل سعد يصر اهل سعد منا اهل شقء يصر عمل اهل شقو اهل سعد يسر عمل اهل سعد وأم اهل شقو يسر عمل اهل شقء قرأ فأم تقى صدق حسنى اية,540,65,Prophetic Commentary on the Qur'an (Tafseer of the Prophet (pbuh)) - كتاب التفسير,صعب
2187,خيل ثلث رجل اجر رجل ستر على رجل وزر فأم اجر رجل ربط سبل أطل مرج روض فما صبت طيل مرج روض حسن انه قطع طيل فست شرف شرف اثر أرواث حسن انه مرت نهر شرب ولم يرد يسق حسن فهى لذلك رجل اجر رجل ربط تغن عفف ولم ينس حق رقب ظهر فهى ستر رجل ربط فخر رئء نوء فهى وزر سئل حمر نزل اية فذة جمع عمل ثقل ذرة خير يره عمل ثقل ذرة شرا يره,618,65,Prophetic Commentary on the Qur'an (Tafseer of the Prophet (pbuh)) - كتاب التفسير,صعب
2188,عمر دخل شيخ بدر فكأ بعض نفس دخل عنا ولن بنء ثله عمر علم فدع يوم أدخل عهم فما رئت دعا مئذ لير تقل قول على جاء نصر فتح بعض امر حمد ونستغفره نصر فتح علي وسك بعض فلم يقل شيئ كذك تقل عبس فقل فما تقل علم جاء نصر فتح وذل علم اجل سبح حمد ربك واستغفره وبا عمر تقل,567,65,Prophetic Commentary on the Qur'an (Tafseer of the Prophet (pbuh)) - كتاب التفسير,صعب
2189,ليت نزل وحى فلم نبي جعر وعل ثوب اظل ومع ناس صحب جءه رجل تضمخ بطب ترى رجل حرم جبة ضمخ بطب نظر نبي سعة فجء وحى أشر عمر على تعل فجء على أدخل رأس حمر وجه يغط سعة سري سأل عمر لمس رجل فجء نبي طيب غسل رات وأم جبة نزع صنع عمر صنع حجك,570,66,Virtues of the Qur'an - كتاب فضائل القرآن,صعب
2190,مرأ جءت فقل جئت أهب نفس نظر الي صعد نظر الي وصب طأطأ رأس فلم رأت رأة يقض شيئ جلس فقم رجل صحب يكن حجة فزج عند شىء ولل ذهب اهل نظر تجد شيئ ذهب ولل وجد شيئ نظر خات حدد ذهب ولل خات حدد زري سهل ردء فله نصف صنع إزر لبس يكن عليها شىء لبس يكن شىء جلس رجل طال جلس فرآ مول أمر فدع فلم جاء معك قرآ معي سور وسر وسر عده قرؤ ظهر قلب ذهب فقد لكت معك قرآ,957,66,Virtues of the Qur'an - كتاب فضائل القرآن,صعب
2191,هشم حكم حزم قرأ سور فرق حية سمع قرء قرؤ حرف كثر قرئ فكد سور صلة فانتظرته سلم لبب فقل قرأ سور سمع قرأ قرأ فقل كذب فلل لهو قرأ سور سمع طلق اقد فقل قرأ سور فرق حرف قرئ وإن قرأ سور فرق هشم قرأ قرأ قرء سمع زلت قرأ عمر قرأ قرأ زلت قرآ نزل حرف قرء يسر,854,66,Virtues of the Qur'an - كتاب فضائل القرآن,صعب
2192,نكح ابي مرأ فكان عهد كنت سأل بعل تقل رجل رجل يطأ فرش ولم فتش كنف اتن فلم طال ذكر نبي قني فلق تصم يوم وكف ختم ليل صم شهر قرإ قرآ شهر اطق صم ايم جمع اطق فطر يوم وصم يوم اطق صم فضل صوم صوم دود صيم يوم إفطار يوم قرأ ليل مرة فلت قبل رخص وذك اني كبر ضعف فكان قرأ اهل سبع قرآ نهر قرؤ عرض نهر ليك اخف ليل ارد تقى فطر ايا أحصى وصم مثل كره يتر شيئ فرق نبي عبد وقل بعض وفي أكثر,913,66,Virtues of the Qur'an - كتاب فضائل القرآن,صعب
2193,خرج يكم قوم حقر صلت صلت صيم صيم عمل عمل قرء قرآ جوز حنجر مرق دين مرق سهم رمة نظر نصل يرى شيئ نظر قدح يرى شيئ نظر ريش يرى شيئ مرى فوق,263,66,Virtues of the Qur'an - كتاب فضائل القرآن,صعب
2194,مرأ عرض نفس نبي رجل زوج عند عند شىء ذهب لمس خات حدد ذهب ولل وجد شيئ خات حدد زري وله نصف سهل ردء نبي صنع إزر لبس يكن عليها شىء لبس يكن شىء جلس رجل طال جلس فرآ نبي فدع دعي معك قرآ معي سور وسر لسر عدد نبي امل معك قرآ,625,67,Wedlock; Marriage (Nikaah) - كتاب النكاح,صعب
2195,ماه خفتم قسط تمى لكت يمن عئش اخت يتم تكون حجر ولي رغب جمل ومل يرد نقص صدق فنه نكح قسط كمل صدق أمر نكح سوا نسء عئش فتى ناس أنزل ويستفتونك نسء رغب أنزل عز وجل اية يتم مال جمل رغب نكح نسب صدق رغب قلة مال جمل ركو أخذ غير نسء فكم ركو رغب فلس كحو رغب قسط عطو حقه وفى صدق,686,67,Wedlock; Marriage (Nikaah) - كتاب النكاح,صعب
2196,انه شرت مرق صور فلم رآه باب فلم دخل عرف وجه كره فقل اتب إلى رسل ذنب بال مرق فقل شري قعد عليها وسد صحب صور عذب يوم قيم يقل احي خلق وقل بيت صور دخل لئك,447,67,Wedlock; Marriage (Nikaah) - كتاب النكاح,صعب
2197,ذكر لعن نبي عصم عدي قول صرف فأت رجل قوم شكو اله مرأ رجل عصم بلي بهذا لقل ذهب نبي أخبر بلذ مرأ رجل صفر قلل لحم سبط شعر دعى وجد اهل خدل ادم كثر لحم نبي لهم فجء شبي رجل ذكر زوج وجد فلع نبي بين رجل لبن عبس جلس نبي رجم احد بغر بين رجم مرأ ظهر سلم سوء صلح عبد وسف خدل,664,68,Divorce - كتاب الطلاق,صعب
2198,ذكر تلع عصم عدي قول صرف فأت رجل قوم ذكر مرأ رجل عصم بلي بهذا امر لقل ذهب أخبر بلذ مرأ رجل صفر قلل لحم سبط شعر اهل ادم خدل كثر لحم جعد قطط لهم وضع شبي رجل ذكر زوج عند فلع بين رجل لبن عبس جلس رجم احد بغر بين رجم عبس مرأ ظهر سوء سلم,667,68,Divorce - كتاب الطلاق,صعب
2199,ابن توف زوج شكت عين كحل مرت ثلث شهر عشر احد جهل ترم بعر رأس حول,268,68,Divorce - كتاب الطلاق,صعب
2200,يحل مرأ تؤم بلل يوم اخر تحد زوج فإن كحل لبس ثوب صبغ ثوب عصب,126,68,Divorce - كتاب الطلاق,صعب
2201,تمس طيب دنى طهر طهر نبذ قسط أظفار,68,68,Divorce - كتاب الطلاق,صعب
2202,يتف نكم يذر زوج عدة عتد اهل زوج وجب أنزل يتف نكم يذر زوج وصة أزواج تعا حول خرج خرج جنح علي فعل نفس عرف تمم سنة شهر عشر ليل وصة شءت سكن وصت شءت خرج قول على خرج خرج جنح علي لعد وجب عليها جهد وقل عطء عبس نسخ اية عدت اهل عتد شءت وقل على خرج وقل عطء شءت عدت اهل وسك وصت شءت خرج لقل جنح علي فعل عطء جاء يرث نسخ كنى عتد شءت كنى,711,68,Divorce - كتاب الطلاق,صعب
2203,نبي حتز كتف شاة يده فدع صلة ألق سكن حتز صلى ولم وضأ,125,70,Food; Meals - كتاب الأطعمة,صعب
2204,قسم نبي يوم صحب تمر أعطى انس تمر أعط تمر احد حشف فلم يكن فيه تمر عجب شدت ضغي,156,70,Food; Meals - كتاب الأطعمة,صعب
2205,كنا نأت انس الك خبز قئم كلا فما نبي رغف رقق لحق بلل شاة سمط بعن,149,70,Food; Meals - كتاب الأطعمة,صعب
2206,لعش نهى نبي ؤكل لحم ضحي فعل عام جاع ناس أرد طعم غني فقر كنا رفع كرع أكل قيل ضطر اله فضح شبع ال حمد خبز بر أدم ايم لحق بلل وقل كثر سفي عبد رحم عبس بهذا,349,70,Food; Meals - كتاب الأطعمة,صعب
2207,برر سنن ردت عئش شري عتق اهل ولن ولء ذكر رسل شئت شرط فإن ولء لمن عتق أعتق فخر تقر زوج فرق دخل يوم بيت عئش على نار برم تفر فدع غدء فأت خبز أدم ادم بيت الم ار لحم قال ولك لحم صدق برر أهد صدق عليها وهد,471,70,Food; Meals - كتاب الأطعمة,صعب
2208,كنت لزم نبي شبع بطن اكل خمر لبس حرر خدم فلن ألصق بطن حصباء أستقرئ رجل اية وهى معي قلب طعم وخر ناس ساك جعفر ابي طلب قلب طعم بيت خرج الي عكة شىء شتق لعق,316,70,Food; Meals - كتاب الأطعمة,صعب
2209,اتى ولى خيط فأت دبء جعل أكل فلم ازل احب رأت أكل,131,70,Food; Meals - كتاب الأطعمة,صعب
2210,صار رجل يقل شعب غلم لحم صنع طعا دعو فدع تبع رجل نبي انك دعت وهذا رجل تبع شئت اذن شئت ترك اذن,304,70,Food; Meals - كتاب الأطعمة,صعب
2211,خيط دعا نبي طعم صنع ذهب نبي قرب خبز شعر مرق دبء قدد فرأ نبي تبع دبء حلى قصع فلم ازل احب دبء مئذ,213,70,Food; Meals - كتاب الأطعمة,صعب
2212,خيط دعا طعم صنع انس ذهب طعم قرب خبز شعر مرق دبء قدد انس فرأ تبع دبء حول صحف فلم ازل احب دبء مئذ وقل ثمم انس جعل دبء يده,337,70,Food; Meals - كتاب الأطعمة,صعب
2213,رأت نبي أكل رطب قثء,51,70,Food; Meals - كتاب الأطعمة,صعب
2214,تضف هرر سبع فكان مرأ خدم عقب ليل ثلث يصل وقظ سمع قسم صحب تمر أصب تمر احد حشف,186,70,Food; Meals - كتاب الأطعمة,صعب
2215,سلم امه عمد مد شعر جشت جعل خطف عصر عكة عند بعث نبي فأت صحب دعو معي فجئ فقل معي خرج اله طلح شىء صنع سلم دخل فجء وقل دخل دخل أكل شبع دخل دخل أكل شبع دخل عد ربع اكل نبي جعل نظر نقص شىء,499,70,Food; Meals - كتاب الأطعمة,صعب
2216,رأت صنع ربع ار احد صحب صنع جرج رأت تمس ارك يمن ورأ لبس نعل سبت ورأ صبغ صفر ورأ كنت بمك اهل ناس رأا هلل ولم تهل يوم روي عبد ارك فإن ار يمس يمن وأم نعل سبت فإن رأت لبس نعل شعر وضأ فأن احب لبس وأم صفر فإن رأت صبغ فأن احب صبغ وأم هلل فإن ار يهل بعث رحل,612,4,Ablutions (Wudu') - كتاب الوضوء,صعب
2217,ليل يمن زوج نبي وهي خلت ضطجع عرض وسد ضطجع أهل طول فنم نصف ليل قبل قلل بعد قلل يقظ جلس مسح نوم وجه بيد قرأ عشر ايت خوا سور ال عمر شن علق وضأ أحس وضء يصل عبس فقم صنع صنع ذهب فقم جنب وضع يده منى رأس أخذ بأذ منى فتل صلى ركع ركع ركع ركع ركع ركع وتر ضطجع اته ؤذن فقم صلى ركع خفف خرج صلى صبح,656,4,Ablutions (Wudu') - كتاب الوضوء,صعب
2218,اتت عئش زوج نبي خسف شمس ناس قيم يصل قئم تصل فقل ناس أشر بيد سمء وقل فقل اية أشر فقم تجل غشى جعل اصب رأس ماء فلم صرف حمد أثنى شىء كنت اره رأت قمي جنة نار اوح نكم تفت قبر قرب فتن دجل ادر سمء ؤتى احد يقل علم بهذا رجل فأم ؤمن وقن ادر سمء يقل حمد جاء بين هدى أجب وآم تبع يقل نم صلح فقد علم كنت مؤم وأم نفق رتب ادر سمء يقل ادر ناس يقل شيئ فقل,751,4,Ablutions (Wudu') - كتاب الوضوء,صعب
2219,ثقل نبي شتد وجع أذن زوج مرض بيت فأذ خرج نبي رجل تخط رجل ارض عبس رجل اخر عبد أخبر عبد عبس تدر رجل اخر علي وكانت عئش حدث نبي دخل بيت شتد وجع هرق قرب حلل اوك لعل عهد ناس أجلس خضب حفص زوج نبي طفق نصب يشر الي فعل خرج ناس,543,4,Ablutions (Wudu') - كتاب الوضوء,صعب
2220,اتت برر سأل كتب فقل شئت اعط اهل ويك ولء وقل اهل شئت اعط بقي وقل سفي مرة شئت عقت ويك ولء فلم جاء ذكر باع أعتق ولء لمن عتق نبر وقل سفي مرة صعد نبر بال قوم شرط شرط كتب شرط شرط كتب فلس شرط مرة علي يحى عبد وهب يحى عمر وقل جعفر عون يحى عمر عئش روه الك يحى عمر برر ولم ذكر صعد نبر,650,8,Prayers (Salat) - كتاب الصلاة,صعب
2221,صلتى عشي سير سما هرر نست صلى ركع سلم فقم خشب عرض سجد تكأ عليها كأن غضب وضع يده منى سرى وشب صبع وضع خده ايم ظهر كفه سرى خرج سرع بوب سجد فقل قصر صلة وفي قوم بكر عمر فهب كلم وفي قوم رجل يده طول يقل يدن سيت قصر صلة انس ولم قصر اكم يدن فقل قدم صلى سلم كبر سجد سجد اطل رفع رأس كبر كبر سجد سجد اطل رفع رأس كبر فرب ألو سلم يقل نبئ عمر حصن سلم,708,8,Prayers (Salat) - كتاب الصلاة,صعب
2222,كنت أصحاب قدم معي سفن نزل بقع بطح نبي دين فكان نوب نبي صلة عشء ليل نفر نهم ففق نبي سلم أصحاب وله شغل امر فأع صلة بهر ليل خرج نبي صلى فلم قضى صلت لمن حضر رسل بشر نعم علي ناس يصل سعة غير سعة غير يدر كلم وسى رجع فرح سمع,575,9,Times of the Prayers - كتاب مواقيت الصلاة,صعب
2223,شغل ليل أخر رقد سجد يقظ رقد يقظ خرج علي نبي اهل ارض نظر صلة غير عمر يبل قدم اخر خشى غلب نوم وقت رقد قبل جرج عطء وقل عبس عتم ليل عشء رقد ناس يقظ رقد يقظ فقم عمر خطب صلة عطء عبس خرج نبي كأن نظر اله قطر رأس ماء وضع يده رأس اشق امت أمر صلو سثب عطء وضع نبي رأس يده بأه عبس بدد عطء صبع شيئ بدد وضع طرف صبع قرن رأس ضمه يمر رأس مست بهم طرف اذن يلي وجه صدغ ونح لحة قصر بطش وقل اشق امت أمر يصل,973,9,Times of the Prayers - كتاب مواقيت الصلاة,صعب
2224,صحب صفة كان نسا قرء وأن نبي عند طعم ذهب ثلث خمس وأن بكر جاء ثلث طلق نبي عشر فهو وأب وأم ادر مرأ خدم بين وبين بيت ابي بكر بكر عشى نبي لبث صلت عشء لبث عشى نبي فجء مضى ليل شاء مرأ حبس ضيف ضيف اوم عشت ابا تجء عرض فأب ذهب خبأ غنثر جدع وسب وقل كلا هنئ ولل طعم ويم كنا أخذ لقم ربا سفل يعن شبع وصر نظر الي بكر مرأ اخت بني فرس وقر عين لهي ثلث رات أكل بكر وقل شيط يعن يمن اكل لقم حمل نبي أصبح عند بين وبين قوم عقد مضى اجل فرق رجل رجل نهم انس رجل أكل جمع,1142,9,Times of the Prayers - كتاب مواقيت الصلاة,صعب
2225,طلق نبي طئف صحب عمد سوق عكظ حيل شيط وبين خبر سمء أرسل علي شهب رجع شيط قوم فقل فقل حيل بين وبين خبر سمء أرسل علي شهب قال حال بين وبين خبر سمء شىء حدث ضرب شرق ارض غرب نظر حال بين وبين خبر سمء صرف توج هام نبي نخل عمد سوق عكظ يصل أصحاب صلة فجر فلم سمع قرآ سمع فقل ولل حال بين وبين خبر سمء هنل رجع قوم وقل قوم سمع قرآ يهد رشد فآم ولن نشر برب احد أنزل نبه قل اوح اوح اله قول الج,756,10,Call to Prayers (Adhaan) - كتاب الأذان,صعب
