,Final_matn,matn_length,chapter_no,chapter,level
791,خرج حجة ودع أهلل عمر معه هدى يهل لحج عمر يحل يحل منه قدم مكة وأن حئض فلم قضي حجن رسل عبد رحم نعم عمر كان عمر فطف اهل عمر حلا طاف طفا اخر رجع منى وأم جمع لحج عمر طاف طفا وحد,406,25,Hajj (Pilgrimage) - كتاب الحج,صعب
792,عمر دخل ابن عبد عبد ظهر دار امن يكون عام ناس قتل صدو بيت فلو اقم خرج فحل كفر قرش بين وبين بيت حيل بين وبن فعل فعل اسة حسن شهد اني وجب عمر قدم فطف طفا وحد,398,25,Hajj (Pilgrimage) - كتاب الحج,صعب
793,عمر ارد لحج عام نزل حجج ببن زبر فقل ناس كئن بين قتل وإن نخف صدو اسة حسن صنع صنع شهد اني وجب عمر خرج ظهر يدء شأن لحج عمر شهد اني وجب عمر أهدى هدا شره قدد ولم يزد فلم نحر ولم يحل شىء حرم ولم حلق ولم قصر يوم نحر نحر حلق رأى قضى طوف لحج عمر طوف اول وقل عمر فعل,591,25,Hajj (Pilgrimage) - كتاب الحج,صعب
794,حج نبي أخبر عئش شىء بدأ قدم وضأ طاف بيت تكن عمر حج بكر فكان شىء بدأ طوف بيت تكن عمر عمر حج عثم فرأ شىء بدأ طوف بيت تكن عمر عاي عبد عمر حجج ابي زبر عوم فكان شىء بدأ طوف بيت تكن عمر رأت هجر صار تكن عمر اخر رأت فعل عمر نقض عمر وهذا عمر عند ألو مضى كان بدء شىء يضع قدم طوف بيت يحل رأت امي وخل قدم بدئ شىء بيت تطف تحل خبر امي انه اهل وأخ زبر وفل وفل عمر فلم مسح ركن حلا,825,25,Hajj (Pilgrimage) - كتاب الحج,صعب
795,ارأ قول على صفا روة شعر حج بيت عمر جنح يطف فلل جنح يطف صفا روة اخت اول جنح تطف ولك زلت صار كان سلم يهل لمن طغي كان عبدو شلل فكان اهل حرج يطف صفا روة فلم سلم سأل قال كنا حرج نطف صفا روة أنزل على صفا روة شعر اية عئش سن طوف بين فلس أحد يتر طوف بين خبر بكر عبد رحم علم كنت سمع رجل اهل علم ذكر ناس ذكر عئش يهل بمن كان يطف كلهم صفا روة فلم ذكر على طوف بيت ولم ذكر صفا روة قرآ قال كنا نطف صفا روة نزل طوف بيت فلم ذكر صفا فهل علي حرج نطف صفا روة أنزل على صفا روة شعر اية بكر أسمع اية نزل فرق كان حرج يطف جهل صفا روة يطف حرج يطف سلم على امر طوف بيت ولم ذكر صفا ذكر ذكر طوف بيت,1377,25,Hajj (Pilgrimage) - كتاب الحج,صعب
796,طاف طوف اول خب ثلث مشى ربع سعى بطن سيل طاف صفا روة فقل نفع اكن عبد يمش بلغ ركن يما زحم ركن فإن يدع سلم,240,25,Hajj (Pilgrimage) - كتاب الحج,صعب
797,رجل طاف بيت عمر ولم يطف صفا روة ايأ مرأ قدم نبي فطف بيت سبع صلى قام ركع فطف صفا روة سبع اسة حسن سأل جبر عبد قرب يطف صفا روة,296,25,Hajj (Pilgrimage) - كتاب الحج,صعب
798,قدم نبي مكة فطف بيت ركع سعى صفا روة تلا اسة حسن,138,25,Hajj (Pilgrimage) - كتاب الحج,سهل
799,اكن تكر سعى صفا روة لأن شعر جهل نزل صفا روة شعر حج بيت عمر جنح يطف,180,25,Hajj (Pilgrimage) - كتاب الحج,سهل
800,سعى بيت وبين صفا روة لير شرك قوت زاد حمد سفي عمرو عطء عبس ثله,154,25,Hajj (Pilgrimage) - كتاب الحج,سهل
801,قدم مكة وأن حئض ولم اطف بيت صفا روة شكو فعل فعل حاج تطف بيت طهر,175,25,Hajj (Pilgrimage) - كتاب الحج,سهل
802,اهل نبي أصحاب لحج وليس نهم هدى نبي طلح قدم علي يمن ومع هدى هلل اهل نبي أمر نبي صحب جعلو عمر يطف قصر يحل معه هدى فقل طلق منى ذكر احد قطر بلغ نبي قبل امر دبر اهد ولل معي هدى أحلل وحض عئش فنس نسك كله انه تطف بيت فلم طهر طفت بيت طلق بحج عمر أنطلق بحج أمر عبد رحم ابي بكر خرج عها نعم عمر لحج,657,25,Hajj (Pilgrimage) - كتاب الحج,صعب
803,كنا منع عتق خرج قدم مرأ نزل قصر بني حدث اخت رجل صحب غزا ثنتى غزة وكانت اخت معه غزو كنا ندو كلمى نقم رضى سأل اخت فقل احد بأس يكن جلباب خرج لبس صحب جلباب شهد خير دعو ؤمن فلم قدم عطة سأل سأل فقل وكانت ذكر بأب فقل سمع وكذ بأب خرج عتق ذوت خدر عتق وذو خدر حيض شهد خير دعو سلم عزل حيض صلى فقل حئض فقل شهد عرف شهد شهد,791,25,Hajj (Pilgrimage) - كتاب الحج,صعب
804,سأل انس الك شىء عقل نبي ظهر عصر يوم روي منى فأن عصر يوم نفر بطح فعل فعل مرؤ,200,25,Hajj (Pilgrimage) - كتاب الحج,صعب
805,خرج منى يوم روي فلق انس ذهب حمر فقل نبي ظهر نظر يصل مرؤ فصل,150,25,Hajj (Pilgrimage) - كتاب الحج,صعب
806,منى ركع أبو بكر عمر عثم صدر خلف,88,25,Hajj (Pilgrimage) - كتاب الحج,سهل
807,نبي ونح كنا وآم منى ركع,77,25,Hajj (Pilgrimage) - كتاب الحج,سهل
808,صلت نبي ركع ومع ابي بكر ركع ومع عمر ركع فرق طرق فيا حظي ركع تقبل,160,25,Hajj (Pilgrimage) - كتاب الحج,سهل
809,شك ناس يوم عرف صوم نبي بعث نبي شرب شرب,99,25,Hajj (Pilgrimage) - كتاب الحج,سهل
810,سأل انس الك وهم غدي منى عرف كنتم صنع يهل منا مهل نكر كبر منا كبر نكر,180,25,Hajj (Pilgrimage) - كتاب الحج,صعب
811,دين حرم قطع شجر حدث حدث حدث فعل لعن لئك ناس جمع,126,29,Virtues of Madinah - كتاب فضائل المدينة,سهل
812,قدم نبي دين أمر بنء سجد بني نجر ثامنو فقل طلب ثمن أمر قبر شرك نبش خرب فسي نخل قطع فصف نخل قبل سجد,214,29,Virtues of Madinah - كتاب فضائل المدينة,صعب
813,حرم بتى دين لسا أتى نبي بني حرث ارا بني حرث خرج حرم تفت,179,29,Virtues of Madinah - كتاب فضائل المدينة,صعب
814,عند شىء كتب وهذ صحف نبي دين حرم عئر حدث حدث اوى حدث فعل لعن لئك ناس جمع قبل صرف عدل وقل ذمة سلم وحد خفر مسل فعل لعن لئك ناس جمع قبل صرف عدل ولى قوم بغر ولي فعل لعن لئك ناس جمع قبل صرف عدل,424,29,Virtues of Madinah - كتاب فضائل المدينة,صعب
815,امر بقر أكل قرى يقل ثرب وهى دين تنف ناس ينف كير خبث حدد,97,29,Virtues of Madinah - كتاب فضائل المدينة,صعب
816,قبل نبي تبك شرف دين طبة,90,29,Virtues of Madinah - كتاب فضائل المدينة,سهل
817,رأت ظبء دين رتع ذعر لبت حرم,103,29,Virtues of Madinah - كتاب فضائل المدينة,صعب
818,يتر دين خير يغش عوف يرد عفي سبع طير آخر حشر رعي زين يرد دين نعق غنم يجد وحش بلغ ثنة ودع خرا وجه,205,29,Virtues of Madinah - كتاب فضائل المدينة,صعب
819,فتح يمن فيأ قوم يبس حمل أهل اطع دين خير كان علم فتح شأم فيأ قوم يبس حمل أهل اطع دين خير كان علم فتح عرق فيأ قوم يبس حمل أهل اطع دين خير كان علم,287,29,Virtues of Madinah - كتاب فضائل المدينة,صعب
820,ايم أرز دين أرز حية جحر,63,29,Virtues of Madinah - كتاب فضائل المدينة,صعب
821,يكد اهل دين ماع نمع ملح ماء,69,29,Virtues of Madinah - كتاب فضائل المدينة,صعب
822,شرف نبي اطم اطم دين ترن أرى وقع فتن خلل بيت كمواقع قطر,126,29,Virtues of Madinah - كتاب فضائل المدينة,صعب
823,دخل دين رعب سيح دجل مئذ بوب باب ملك,84,29,Virtues of Madinah - كتاب فضائل المدينة,سهل
824,قاب دين لئك دخل طاع دجل,65,29,Virtues of Madinah - كتاب فضائل المدينة,سهل
825,بلد يطؤ دجل مكة دين نقب نقب لئك صاف حرسو رجف دين أهل رجف خرج كفر نفق,174,29,Virtues of Madinah - كتاب فضائل المدينة,صعب
826,حدث طول دجل فكان يأت دجل حرم دخل نقب دين سبخ دين خرج اله مئذ رجل خير ناس خير ناس يقل شهد انك دجل عنك حدث يقل دجل ارأ قتل احي تشك امر يقل قتل يحي يقل يحي ولل كنت اشد بصر مني يقل دجل قله سلط,469,29,Virtues of Madinah - كتاب فضائل المدينة,صعب
827,جاء عرب نبي بيع سلم فجء لغد حمو اقل أبى رار دين كير تنف خبث نصع طيب,160,29,Virtues of Madinah - كتاب فضائل المدينة,صعب
828,خرج نبي ناس صحب فقل فرق قتل وقل فرق قتل نزل فما نفق فئت وقل نبي انه تنف رجل تنف نار خبث حدد,226,29,Virtues of Madinah - كتاب فضائل المدينة,صعب
829,لهم جعل دين ضعفى جعل بمك برك,57,29,Virtues of Madinah - كتاب فضائل المدينة,سهل
830,نبي قدم سفر نظر جدر دين وضع رحل دبة حرك حبه,115,29,Virtues of Madinah - كتاب فضائل المدينة,سهل
831,ارد بنو سلم تحل قرب سجد فكر عرى دين وقل بني سلم حسب اثر أقم,153,29,Virtues of Madinah - كتاب فضائل المدينة,سهل
832,بيت نبر روض ريض جنة نبر حوض,65,29,Virtues of Madinah - كتاب فضائل المدينة,سهل
833,قدم دين وعك بكر بلل فكان بكر اخذ حمى مرئ صبح اهل موت دنى شرك نعل بلل قلع حمى رفع عقر شعر ابي ليل بود وحل ذخر جلل وهل ارد يوم ياه جنة وهل يبد شمة طفل لهم الع شيب ربع عتب ربع وأم خرجو ارض ارض وبء لهم حبب الي دين كحب مكة اشد لهم برك صاع وفي دنا صحح نقل حما جحف قدم دين وهى وبأ ارض فكان بطح يجر نجل تعن ماء اجن,628,29,Virtues of Madinah - كتاب فضائل المدينة,صعب
834,عمر لهم رزق شهد سبل جعل وتي بلد رسل,95,29,Virtues of Madinah - كتاب فضائل المدينة,سهل
835,عرب جاء ثئر رأس فرض صلة صلو خمس تطع شيئ فرض صيم شهر رمض تطع شيئ فرض زكة أخبر شرع سلم كرم تطع شيئ نقص فرض شيئ فلح صدق دخل جنة صدق,479,30,Fasting - كتاب الصوم,سهل
836,صام نبي عاشوراء أمر صيم فلم فرض رمض عبد يصم يفق صوم,119,30,Fasting - كتاب الصوم,سهل
837,قرش تصم يوم عاشوراء جهل امر صيم فرض رمض وقل شاء يصم شاء فطر,171,30,Fasting - كتاب الصوم,سهل
838,صيم جنة رفث جهل مرؤ قتل شتم يقل صئم مرت نفس بيد خلف فم صئم اطب على ريح مسك يتر طعم شرب شهو اجل صيم وأن اجز حسن عشر مثل,235,30,Fasting - كتاب الصوم,صعب
839,حفظ حدث نبي فتن حذف سمع فتن رجل اهل ومل وجر كفر صلة صيم صدق سأل سأل تمج يمج بحر ببا غلق فتح كسر كسر جدر غلق يوم قيم فقل سرق سله اكن عمر علم باب سأل علم غد ليل,397,30,Fasting - كتاب الصوم,صعب
840,جنة ببا يقل رين دخل صئم يوم قيم دخل غير يقل صئم يقم دخل غير دخل غلق فلم دخل,180,30,Fasting - كتاب الصوم,سهل
841,نفق زوج سبل نود بوب جنة عبد خير اهل صلة دعي باب صلة اهل جهد دعي باب جهد اهل صيم دعي باب رين اهل صدق دعي باب صدق بكر بأب وأم دعي بوب ضرر فهل دعى بوب كله أرجو تكون نهم,411,30,Fasting - كتاب الصوم,صعب
842,جاء رمض فتح بوب جنة,40,30,Fasting - كتاب الصوم,سهل
843,دخل شهر رمض فتح بوب سمء غلق بوب جهنم لسل شيط,81,30,Fasting - كتاب الصوم,سهل
844,رأيتمو فصم رأيتمو أفطر غم علي قدر,74,30,Fasting - كتاب الصوم,صعب
845,ليل قدر ايم واحتسابا غفر قدم ذنب صام رمض ايم واحتسابا غفر قدم ذنب,121,30,Fasting - كتاب الصوم,سهل
846,نبي اجد ناس خير اجد يكون رمض يلق جبريل جبريل سلم يلق ليل رمض سلخ عرض نبي قرآ لقه جبريل سلم اجد خير ريح رسل,256,30,Fasting - كتاب الصوم,صعب
847,يدع قول زور عمل فلس لله حجة يدع طعم شرب,77,30,Fasting - كتاب الصوم,صعب
848,عمل ادم صيم فإن وأن اجز صيم جنة يوم صوم احد رفث صخب سبه قتل يقل مرؤ صئم حمد بيد خلف فم صئم اطب ريح مسك صئم فرح فرح فطر فرح لقي ربه فرح بصم,298,30,Fasting - كتاب الصوم,صعب
849,طاع بءة تزج فإن اغض بصر أحص فرج سطع فعل صوم فإن وجء,104,30,Fasting - كتاب الصوم,صعب
850,ذكر رمض تصم ترا هلل فطر تره غم علي قدر,126,30,Fasting - كتاب الصوم,صعب
851,شهر عشر ليل تصم تره غم علي أكمل عدة,88,30,Fasting - كتاب الصوم,صعب
852,شهر هكذ خنس بهم ثلث,54,30,Fasting - كتاب الصوم,صعب
853,صوم لرؤ أفطر لرؤ غبي علي أكمل عدة شعب,79,30,Fasting - كتاب الصوم,صعب
854,نبي الى نسه شهر فلم مضى عشر يوم فقل انك حلف دخل شهر شهر يكون عشر يوم,163,30,Fasting - كتاب الصوم,سهل
855,الى نسه وكانت فكت رجل أقم شرب تسع عشر ليل نزل فقل الت شهر شهر يكون تسع عشر,175,30,Fasting - كتاب الصوم,صعب
856,شهر نقص شهر عيد رمض وذو حجة,51,30,Fasting - كتاب الصوم,سهل
857,امة امة كتب حسب شهر هكذ يعن مرة عشر ومر,95,30,Fasting - كتاب الصوم,سهل
858,قدم احد رمض بصم يوم يوم يكون رجل يصم صوم يصم,96,30,Fasting - كتاب الصوم,سهل
859,صحب حمد رجل صائ حضر فطر فنم فطر أكل ليل يوم يمس قيس صرم صار صائ فلم حضر فطر اتى مرأ عند طعم طلق أطلب يوم عمل غلب عين فجء مرأ فلم رأت خيب فلم نصف نهر غشي ذكر نبي نزل اية احل ليل صيم رفث نسئ فرح فرح شدد نزل وكل شرب يتب خيط ابض خيط اسد,523,30,Fasting - كتاب الصوم,صعب
860,نزل يتب خيط ابض خيط اسد عمد عقل اسد إلى عقل ابض جعل وسد جعل نظر ليل ستب غدو ذكر سود ليل بيض نهر,250,30,Fasting - كتاب الصوم,صعب
861,زلت وكل شرب يتب خيط ابض خيط اسد ولم نزل فجر فكان رجل ارد صوم ربط احد رجل خيط ابض خيط اسد ولم يزل أكل يتب رؤت أنزل فجر علم يعن ليل نهر,263,30,Fasting - كتاب الصوم,سهل
862,بلل يؤذ بلل كلا شرب يؤذ كتم فإن يؤذ طلع فجر قسم ولم يكن ذنه رقى نزل,190,30,Fasting - كتاب الصوم,سهل
863,كنت سحر اهل تكون سرع ادر سجد,82,30,Fasting - كتاب الصوم,سهل
864,سحر نبي صلة اذن سحر قدر اية,106,30,Fasting - كتاب الصوم,سهل
865,نبي وصل فصل ناس فشق علي فنه قال انك وصل كهئ اظل أسقى,128,30,Fasting - كتاب الصوم,سهل
866,سحر سحر برك,35,30,Fasting - كتاب الصوم,سهل
867,نبي بعث رجل يند ناس يوم عاشوراء اكل فلي يصم أكل أكل,119,30,Fasting - كتاب الصوم,سهل
868,يدر فجر جنب اهل غسل يصم وقل مرو عبد رحم حرث قسم بلل قرع هرر مرو مئذ دين بكر فكر عبد رحم قدر جتمع بذي حلف وكانت لأب هرر ارض عبد رحم لأب هرر ذكر امر ولل مرو قسم ذكر ذكر قول عئش وأم سلم فضل عبس وهن وقل همم وبن عبد عمر ابي هرر نبي أمر فطر اول سند,529,30,Fasting - كتاب الصوم,سهل
869,نبي قبل بشر صئم امل إرب وقل عبس آرب حجة طوس اول ارب حمق حجة نسء,167,30,Fasting - كتاب الصوم,صعب
870,قبل زوج صئم ضحك,72,30,Fasting - كتاب الصوم,سهل
871,بين خمل حضت سلل أخذ ثيب حيض فست دخل معه خمل وكانت رسل غسل انء قبل صئم,232,30,Fasting - كتاب الصوم,صعب
872,نبي يدر فجر جنب رمض حلم غسل يصم,88,30,Fasting - كتاب الصوم,صعب
873,شهد صبح جنب جمع حلم يصم دخل سلم فقل,124,30,Fasting - كتاب الصوم,صعب
874,نسي أكل شرب فلي صوم فإن طعم وسق,62,30,Fasting - كتاب الصوم,سهل
875,رأت عثم وضأ أفرغ يده ثلث ضمض نثر غسل وجه ثلث غسل يده منى رفق ثلث غسل يده سرى رفق ثلث مسح رأس غسل رجل منى ثلث سرى ثلث رأت وضأ وضئ وضأ وضئ يصل ركع نفس فيه شىء غفر قدم ذنب,383,30,Fasting - كتاب الصوم,صعب
876,رجل اتى نبي حرق الك اصب اهل رمض فأت نبي كتل دعى عرق حرق صدق بهذا,212,30,Fasting - كتاب الصوم,صعب
877,بين جلس نبي جءه رجل هلك وقع مرأ وأن صئم تجد رقب عتق فهل تطع تصم شهر تابع فهل تجد طعم سكي مكث نبي فبي اتي نبي عرق تمر عرق كتل سئل خذه صدق رجل على فقر مني فلل لبت يرد حرت اهل بيت فقر اهل بيت فضح نبي بدت ياب طعم اهل,671,30,Fasting - كتاب الصوم,صعب
878,جاء رجل نبي اخر وقع مرأ رمض تجد حرر رقب تطع تصم شهر تابع فجد طعم سكي فأت نبي عرق تمر زبل عنك احج منا لبت اهل بيت احج منا أطعم اهل,396,30,Fasting - كتاب الصوم,صعب
879,قمه ايم واحتسابا غفر قدم ذنب,56,31,Praying at Night in Ramadaan (Taraweeh) - كتاب صلاة التراويح,سهل
880,رمض ايم واحتسابا غفر قدم ذنب,61,31,Praying at Night in Ramadaan (Taraweeh) - كتاب صلاة التراويح,سهل
881,خرج عمر خطب ليل رمض سجد ناس وزع تفرق يصل رجل نفس يصل رجل يصل بصل رهط عمر جمع قرئ لكن مثل عزم جمع ابى كعب خرج معه ليل خرى ناس يصل بصل قرئ عمر بدع والتي ينم فضل يقم يرد اخر ليل ناس يقم اول,380,31,Praying at Night in Ramadaan (Taraweeh) - كتاب صلاة التراويح,صعب
882,وذل رمض,52,31,Praying at Night in Ramadaan (Taraweeh) - كتاب صلاة التراويح,سهل
883,خرج ليل جوف ليل صلى سجد صلى رجل بصل أصبح ناس حدث جمع نهم فصل معه أصبح ناس حدث كثر اهل سجد ليل ثلث خرج صلى فصل بصل فلم ليل ربع عجز سجد اهل خرج لصل صبح فلم قضى فجر ناس شهد فإن يخف ولك خشت فرض علي عجز فتف امر,491,31,Praying at Night in Ramadaan (Taraweeh) - كتاب صلاة التراويح,صعب
884,ابي سلم عبد رحم سأل عئش صلة رمض فقل يزد رمض غير ركع يصل ربع تسل حسن وطل يصل ربع تسل حسن وطل يصل ثلث فقل تنم وتر عئش عينى تنم ينم قلب,349,31,Praying at Night in Ramadaan (Taraweeh) - كتاب صلاة التراويح,صعب
885,صام رمض ايم واحتسابا غفر قدم ذنب ليل قدر ايم واحتسابا غفر قدم ذنب,120,32,Virtues of the Night of Qadr - كتاب فضل ليلة القدر,سهل
886,رجل صحب نبي ارا ليل قدر نام سبع وخر رؤا وطأ سبع وخر تحر تحر سبع وخر,210,32,Virtues of the Night of Qadr - كتاب فضل ليلة القدر,سهل
887,ابي سلم سأل سعد صدق عكف نبي عشر وسط رمض خرج صبح خطب وقل ارت ليل قدر سيت نست مسو عشر وخر وتر وإن رأت اني سجد ماء وطن عكف رجع رجع نرى سمء قزع فجء سحب مطر سال سقف سجد جرد نخل أقم صلة فرأ سجد ماء طين رأت اثر طين جبه,505,32,Virtues of the Night of Qadr - كتاب فضل ليلة القدر,صعب
888,تحر ليل قدر وتر عشر وخر رمض,62,32,Virtues of the Night of Qadr - كتاب فضل ليلة القدر,سهل
889,جور رمض عشر وسط شهر يمس ليل تمض قبل عشر سكن رجع جور معه وأن اقم شهر جور ليل رجع خطب ناس أمر شاء كنت جور عشر بدا جور عشر وخر عكف معي يثب عكف ارت ليل سيت بغو عشر وخر بغو وتر رأت سجد ماء وطن سهل سمء ليل أمطر وكف سجد صلى نبي ليل عشر بصر عين نظر اله صرف صبح وجه ملئ طين ومء,669,32,Virtues of the Night of Qadr - كتاب فضل ليلة القدر,صعب
890,جور عشر وخر رمض يقل تحر ليل قدر عشر وخر رمض,125,32,Virtues of the Night of Qadr - كتاب فضل ليلة القدر,سهل
891,مسو عشر وخر رمض ليل قدر اسع بقى سبع بقى خمس بقى,100,32,Virtues of the Night of Qadr - كتاب فضل ليلة القدر,سهل
892,عشر يمض يبق يعن ليل قدر عبد وهب ايب وعن خلد عكرم عبس تمس عشر,155,32,Virtues of the Night of Qadr - كتاب فضل ليلة القدر,سهل
893,خرج نبي خبر بلل قدر لحى رجل سلم خرج أخبر بلل قدر لحى وفل رفع عسى يكون خير مسو اسع سبع خمس,205,32,Virtues of the Night of Qadr - كتاب فضل ليلة القدر,صعب
894,نبي دخل عشر شد ئزر وأح ليل أيقظ اهل,78,32,Virtues of the Night of Qadr - كتاب فضل ليلة القدر,سهل
895,عكف عشر وخر رمض,64,33,Retiring to a Mosque for Remembrance of Allah (I'tikaf) - كتاب الاعتكاف,سهل
896,نبي عكف عشر وخر رمض توف عكف زوج بعد,103,33,Retiring to a Mosque for Remembrance of Allah (I'tikaf) - كتاب الاعتكاف,سهل
897,عكف عشر وسط رمض عكف عما ليل عشر وهي ليل خرج صبح عكف عكف معي عكف عشر وخر ارت ليل سيت رأت سجد ماء وطن صبح مسو عشر وخر مسو وتر مطر سمء ليل سجد عرش وكف سجد بصر عيناى جبه اثر ماء طين صبح عشر,477,33,Retiring to a Mosque for Remembrance of Allah (I'tikaf) - كتاب الاعتكاف,صعب
898,نبي يصغ رأس جار سجد أرجل وأن حئض,83,33,Retiring to a Mosque for Remembrance of Allah (I'tikaf) - كتاب الاعتكاف,سهل
899,دخل رأس سجد أرجل دخل بيت لحج عكف,114,33,Retiring to a Mosque for Remembrance of Allah (I'tikaf) - كتاب الاعتكاف,صعب
900,نبي بشر وأن حئض خرج رأس سجد عكف أغسل وأن حئض,104,33,Retiring to a Mosque for Remembrance of Allah (I'tikaf) - كتاب الاعتكاف,سهل
901,عمر سأل نبي كنت نذر جهل عكف ليل سجد حرم فأف نذر,118,33,Retiring to a Mosque for Remembrance of Allah (I'tikaf) - كتاب الاعتكاف,سهل
902,نبي عكف عشر وخر رمض فكن ضرب خبء يصل صبح دخل فاستأذنت حفص عئش ضرب خبء فأذ ضرب خبء فلم رأت زينب ابن جحش ضرب خبء اخر فلم نبي خبي أخبر نبي لبر ترن فتر عكف شهر عكف عشر شول,377,33,Retiring to a Mosque for Remembrance of Allah (I'tikaf) - كتاب الاعتكاف,صعب
903,نبي ارد عكف فلم صرف كان ارد عكف خبي خبء عئش خبء حفص خبء زينب لبر تقل صرف فلم عكف عكف عشر شول,208,33,Retiring to a Mosque for Remembrance of Allah (I'tikaf) - كتاب الاعتكاف,صعب
