,Final_matn,matn_length,chapter_no,chapter,level
1409,حسد اثن رجل علم قرآ فهو تلو ليل آنء نهر سمع جار ليت ويت اوت عمل عمل رجل اته الا فهو يهل لحق رجل ليت ويت اوت عمل عمل,246,66,Virtues of the Qur'an - كتاب فضائل القرآن,سهل
1410,جاء رهط بيت زوج نبي سأل عبد نبي فلم خبر كأن قلو فقل وأن نبي غفر قدم ذنب أخر احد فإن اصل ليل وقل اخر اصم دهر فطر وقل اخر عزل نسء تزج فجء قلتم وكذ ولل أخش لله أتق لكن اصم أفطر أصل أرقد أتزوج نسء رغب سنت فلس مني,506,67,Wedlock; Marriage (Nikaah) - كتاب النكاح,صعب
1411,عرة سأل عئش قول على خفتم قسط تمى نكح طاب نسء ثنى ثلث ربع خفتم عدل فحد لكت يمن دنى تعل اخت يتم تكون حجر ولي رغب مال جمل يرد تزج أدنى سنة صدق فنه كحو قسط كمل صدق أمر نكح سوا نسء,390,67,Wedlock; Marriage (Nikaah) - كتاب النكاح,صعب
1412,كنت عبد فلق عثم منى عبد رحم حجة فخل عثم عبد رحم نزج بكر ذكر كنت عهد فلم عبد حجة اشر علقم فنت اله نبي عشر شبب طاع نكم بءة تزج سطع فعل صوم فإن وجء,388,67,Wedlock; Marriage (Nikaah) - كتاب النكاح,صعب
1413,دخل علقم اسد عبد عبد كنا نبي شبب نجد شيئ عشر شبب طاع بءة تزج فإن اغض بصر أحص فرج سطع فعل صوم فإن وجء,257,67,Wedlock; Marriage (Nikaah) - كتاب النكاح,صعب
1414,حضر عبس جنز يمن سرف عبس زوج نبي رفع نعش زعزعو زلزلو رفق فإن نبي قسم لثم قسم لحد,213,67,Wedlock; Marriage (Nikaah) - كتاب النكاح,سهل
1415,نبي يطف نسه ليل وحد وله نسة,77,67,Wedlock; Marriage (Nikaah) - كتاب النكاح,سهل
1416,سعد جبر عبس تزج تزج خير امة كثر نسء,98,67,Wedlock; Marriage (Nikaah) - كتاب النكاح,سهل
1417,عمل نية مرئ نوى هجر رسل هجر رسل هجر دنا يصب مرأ نكح هجر هجر اله,188,67,Wedlock; Marriage (Nikaah) - كتاب النكاح,سهل
1418,كنا غزو نبي وليس نسء فقل تخص فنه,97,67,Wedlock; Marriage (Nikaah) - كتاب النكاح,سهل
1419,قدم عبد رحم عوف آخى نبي بين وبين سعد ربع صار عند صار مرأ عرض نصف اهل ومل برك اهل ومل دلو سوق أتى سوق ربح شيئ اقط وشئ سمن فرآ نبي ايم وعل وضر صفر هيم عبد رحم تزج صار فما سقت وزن نوة ولم بشة,417,67,Wedlock; Marriage (Nikaah) - كتاب النكاح,صعب
1420,رد عثم مظع بتل اذن ختص,81,67,Wedlock; Marriage (Nikaah) - كتاب النكاح,صعب
1421,رد يعن نبي عثم اجز بتل ختص,82,67,Wedlock; Marriage (Nikaah) - كتاب النكاح,صعب
1422,كنا غزو وليس شىء فقل تخص فنه رخص نكح رأة ثوب قرأ علي امن حرم طيب احل عتد يحب عتد,227,67,Wedlock; Marriage (Nikaah) - كتاب النكاح,صعب
1423,رجل شاب وأن اخف نفس عنت اجد تزج نسء فسك فسك فسك نبي هرر جف قلم لاق ختص ذر,253,67,Wedlock; Marriage (Nikaah) - كتاب النكاح,صعب
1424,ارأ نزل واد وفه شجر اكل وجد شجر ؤكل كنت رتع بعر رتع تعن تزج بكر غير,203,67,Wedlock; Marriage (Nikaah) - كتاب النكاح,صعب
1425,ارت نام مرت رجل حمل سرق حرر يقل مرأ أكشف أقل يكن يمض,132,67,Wedlock; Marriage (Nikaah) - كتاب النكاح,صعب
1426,قفل نبي غزة عجل بعر قطف لحق ركب خلف نخس بعر عنز معه طلق بعر كأجود ابل نبي عجل كنت حدث عهد عرس بكر ثيب ثيب فهل جري لعب لعب فلم ذهب دخل مهل دخل ليل عشء لكى مشط شعث سحد غيب,414,67,Wedlock; Marriage (Nikaah) - كتاب النكاح,صعب
1427,تزج تزج فقل تزج ثيب عذرى لعب ذكر عمرو عمرو جبر عبد جري لعب لعب,255,67,Wedlock; Marriage (Nikaah) - كتاب النكاح,صعب
1428,نبي خطب عئش ابي بكر بكر اخك اخي دين كتب وهى حلل,135,67,Wedlock; Marriage (Nikaah) - كتاب النكاح,سهل
1429,خير نسء ركب ابل صالحو نسء قرش حنه ولد صغر أرع زوج يده,94,67,Wedlock; Marriage (Nikaah) - كتاب النكاح,صعب
1430,ايم رجل عند ولد علم أحس علم أدب أحس أدب عتق تزج فله اجر وأي رجل اهل كتب امن بنب وآم فله اجر وأي ملك ادى حق ولي وحق ربه فله اجر شعب خذه بغر شىء رجل رحل دون دين وقل بكر ابي حصن ابي برد ابه نبي عتق صدق,373,67,Wedlock; Marriage (Nikaah) - كتاب النكاح,سهل
1431,كذب راهيم كذب بين راهيم مر جبر ومع سرة ذكر حدث أعط هجر كف يد كفر أخدم اجر هرر فتل مكم بني ماء سمء,179,67,Wedlock; Marriage (Nikaah) - كتاب النكاح,صعب
1432,اقم نبي خيبر دين ثلث بنى بصف حيى دعو سلم ولم فما خبز لحم امر طاع ألقى تمر اقط سمن فكن ولم سلم امه ؤمن لكت يمن فقل حجب فهى امه ؤمن حجب فهى لكت يمن فلم رحل وطى خلف ومد حجب بين وبين ناس,374,67,Wedlock; Marriage (Nikaah) - كتاب النكاح,صعب
1433,عتق صفة جعل عتق صدق,63,67,Wedlock; Marriage (Nikaah) - كتاب النكاح,سهل
1434,جءت مرأ فقل جئت اهب نفس نظر الي صعد نظر وصب طأطأ رأس فلم رأت رأة يقض شيئ جلس فقم رجل صحب يكن حجة فزج وهل عند شىء ولل ذهب اهل نظر تجد شيئ ذهب ولل وجد شيئ نظر خات حدد ذهب ولل خات حدد زري سهل ردء فله نصف صنع إزر لبس يكن عليها شىء لبس يكن شىء جلس رجل طال جلس فرآ مول أمر فدع فلم جاء معك قرآ معي سور وسر عدد قرؤ ظهر قلب ذهب فقد لكت معك قرآ,996,67,Wedlock; Marriage (Nikaah) - كتاب النكاح,صعب
1435,حذف عتب ربع عبد شمس شهد بدر نبي بنى سال أنكح اخه هند ولد عتب ربع ولى مرأ صار بنى نبي زيد بنى رجل جهل دعه ناس اله ورث يرث نزل دعو آبئ قول وال فرد ابئ علم اب ولى وأخ دين فجء سهل سهل عمرو قرش عمر وهى مرأ ابي حذف نبي فقل كنا نرى سال ولد نزل علم ذكر حدث,571,67,Wedlock; Marriage (Nikaah) - كتاب النكاح,صعب
1436,دخل ضبع زبر لعل ارد لحج ولل اجد وجع حجي شرط قول لهم حلي حبس وكانت قدد اسد,211,67,Wedlock; Marriage (Nikaah) - كتاب النكاح,صعب
1437,نكح رأة أربع لمل حسب جمل ولد ظفر بذت دين ترب يدك,87,67,Wedlock; Marriage (Nikaah) - كتاب النكاح,صعب
1438,مر رجل تقل قال حري خطب نكح شفع شفع سمع سكت فمر رجل قرء سلم تقل قال حري خطب نكح شفع شفع سمع خير ملء ارض,350,67,Wedlock; Marriage (Nikaah) - كتاب النكاح,صعب
1439,عرة سأل عئش خفتم قسط تمى اخت يتم تكون حجر ولي رغب جمل ومل يرد نقص صدق فنه نكح قسط كمل صدق أمر نكح سوا فتى ناس أنزل ويستفتونك نسء رغب كحو أنزل يتم جمل ومل رغب نكح نسب كمل صدق رغب قلة مال جمل ركو أخذ غير نسء فكم ركو رغب فلس كحو رغب قسط عطو حقه وفى صدق,650,67,Wedlock; Marriage (Nikaah) - كتاب النكاح,صعب
1440,شؤم رأة دار فرس,40,67,Wedlock; Marriage (Nikaah) - كتاب النكاح,سهل
1441,ذكر شؤم نبي نبي شؤم شىء ففي دار رأة فرس,126,67,Wedlock; Marriage (Nikaah) - كتاب النكاح,سهل
1442,شىء ففي فرس رأة سكن,50,67,Wedlock; Marriage (Nikaah) - كتاب النكاح,سهل
1443,ترك بعد فتن اضر رجل نسء,52,67,Wedlock; Marriage (Nikaah) - كتاب النكاح,سهل
1444,برر سنن عتق فخر وقل ولء لمن عتق دخل برم نار قرب اله خبز أدم ادم بيت ار برم فقل لحم صدق برر وأن أكل صدق عليها صدق ولن هدة,291,67,Wedlock; Marriage (Nikaah) - كتاب النكاح,صعب
1445,خفتم قسط تمى يتم تكون رجل ولي تزج مال يسء صحب عدل مال تزج طاب نسء سوا ثنى ثلث ربع,188,67,Wedlock; Marriage (Nikaah) - كتاب النكاح,صعب
1446,عمر عبد رحم عئش زوج نبي خبر عند وأن صوت رجل سأذ بيت حفص فقل رجل سأذ بيت نبي اره فلا لعم حفص رضع عئش حيا لعم رضع دخل رضع حرم حرم ولد,378,67,Wedlock; Marriage (Nikaah) - كتاب النكاح,سهل
1447,قيل نبي تزج ابن حمز انه ابن اخي رضع,87,67,Wedlock; Marriage (Nikaah) - كتاب النكاح,سهل
1448,عرة زبر زينب ابن ابي سلم خبر حبب ابي سفي خبر انه نكح اخت ابي سفي وحب فقل مخل أحب شرك خير اخت نبي يحل فإن حدث انك ترد نكح ابي سلم سلم انه تكن ربب حجر حلت انه لبن اخي رضع رضع وأب سلم ثوب عرض بنت خوت عرة ثوب ولة لأب لهب لهب عتق أرضع نبي فلم مات لهب اره اهل بشر حيب لقت لهب الق بعد اني سقت عتق ثوب,701,67,Wedlock; Marriage (Nikaah) - كتاب النكاح,صعب
1449,نبي دخل عليها عند رجل فكأ تغر وجه كأن كره فقل اخي ظرن خون فإن رضع جاع,155,67,Wedlock; Marriage (Nikaah) - كتاب النكاح,سهل
1450,فلح اخا ابي قعس جاء سأذ عليها عمه رضع نزل حجب فأب اذن فلم جاء خبر بلذ صنع أمر اذن,173,67,Wedlock; Marriage (Nikaah) - كتاب النكاح,سهل
1451,حدث عبد حفظ تزج مرأ فجء مرأ ودء فقل رضع فأت نبي فقل تزج فلن فجء مرأ ودء فقل رضع وهى كذب أعرض فأت وجه انه كذب زعم انه رضع دعه عنك أشر اعل إصبع سبب سطى يحك ايب,337,67,Wedlock; Marriage (Nikaah) - كتاب النكاح,سهل
1452,حرم نسب صهر قرأ حرم علي مهت اية جمع عبد جعفر ابن علي مرأ علي وقل سير بأس وكر حسن مرة بأس جمع حسن حسن علي نتى ليل وكر جبر زيد قطع وليس حرم لقل على أحل ورء وقل عكرم عبس زنى بأخ مرأ حرم مرأ يرى يحى كند شعب وأب جعفر فيم لعب صبي دخل تزج امه يحى عرف تبع وقل عكرم عبس زنى حرم مرأ ذكر ابي نصر عبس حرم أبو نصر عرف سمع عبس يرى عمر حصن جبر زيد حسن بعض اهل عرق حرم وقل هرر حرم لزق ارض يعن جمع وجز سيب عرو زهر وقل زهر علي حرم وهذا رسل,853,67,Wedlock; Marriage (Nikaah) - كتاب النكاح,صعب
1453,ابي سفي أفعل نكح تحب مخل أحب شرك فيك اخت انه تحل بلغ انك خطب ابن سلم تكن ربب حلت رضع وأب ثوب عرض بنت خوت,332,67,Wedlock; Marriage (Nikaah) - كتاب النكاح,صعب
1454,عرة زبر خبر زينب ابن ابي سلم خبر حبب نكح اخت ابي سفي تحب مخل أحب شرك خير اخت نبي يحل فلل حدث انك ترد نكح درة ابي سلم سلم فقل فلل تكن حجر حلت انه لبن اخي رضع رضع وأب سلم ثوب عرض بنت خوت,490,67,Wedlock; Marriage (Nikaah) - كتاب النكاح,سهل
1455,نهى نكح رأة عمت خلت,70,67,Wedlock; Marriage (Nikaah) - كتاب النكاح,سهل
1456,جمع رأة وعم رأة وخل,59,67,Wedlock; Marriage (Nikaah) - كتاب النكاح,سهل
1457,نهى نبي نكح رأة عمت رأة وخل نرى خلة ابي بتل نزل,104,67,Wedlock; Marriage (Nikaah) - كتاب النكاح,سهل
1458,لأن عرة عئش حرم رضع حرم نسب,66,67,Wedlock; Marriage (Nikaah) - كتاب النكاح,سهل
1459,نهى شغر شغر يزج رجل ابن يزج اخر ابن بين صدق,119,67,Wedlock; Marriage (Nikaah) - كتاب النكاح,صعب
1460,خول حكم وهب نفس نبي فقل عئش سحي رأة تهب نفس رجل فلم نزل رجئ تشء نهن ربك سرع هوك,196,67,Wedlock; Marriage (Nikaah) - كتاب النكاح,سهل
1461,نبأ عبس تزج نبي حرم,72,67,Wedlock; Marriage (Nikaah) - كتاب النكاح,سهل
1462,نبي نهى تعة وعن لحم حمر هلي زمن خيبر,73,67,Wedlock; Marriage (Nikaah) - كتاب النكاح,صعب
1463,عبس سئل تعة نسء رخص ولى حال شدد وفي نسء قلة نحه عبس,127,67,Wedlock; Marriage (Nikaah) - كتاب النكاح,سهل
1464,قلا كنا جيش فأت اذن متع متع,104,67,Wedlock; Marriage (Nikaah) - كتاب النكاح,سهل
1465,اغر حرم فحش احب اله مدح,88,67,Wedlock; Marriage (Nikaah) - كتاب النكاح,سهل
1466,امة حمد اغر يرى عبد امت تزن امة حمد علم لضح قلل ولب,124,67,Wedlock; Marriage (Nikaah) - كتاب النكاح,سهل
1467,شىء اغر,30,67,Wedlock; Marriage (Nikaah) - كتاب النكاح,سهل
1468,يغر وغر يأت ؤمن حرم,60,67,Wedlock; Marriage (Nikaah) - كتاب النكاح,سهل
1469,سمء ابي بكر تزج زبر ارض مال ملك شىء نضح وغر فرس فكن علف فرس أستق ماء أخرز غرب أعج ولم اكن احس خبز خبز جار صار وكن نسة صدق وكن نقل نوى ارض زبر قطع رأس وهى مني ثلثى رسخ فجئ يوم نوى رأس فلق ومع نفر صار فدع اخ اخ حمل خلف فاستحييت اسر رجل ذكر زبر وغر اغر ناس عرف اني حيي مضى فجئ زبر فقل لقي على رأس نوى ومع نفر صحب أنخ أركب فاستحييت عرف غير ولل حمل نوى اشد ركب معه رسل بكر خدم يكف سيس فرس فكأ عتق,838,67,Wedlock; Marriage (Nikaah) - كتاب النكاح,صعب
1470,نبي نسه أرسل امه ؤمن صحف طعم ضرب نبي بيت يد خدم سقط صحف فلق جمع نبي فلق صحف جمع طعم صحف يقل غرت مكم حبس خدم اتي صحف بيت دفع صحف صحح كسر صحف أمس كسر بيت كسر,403,67,Wedlock; Marriage (Nikaah) - كتاب النكاح,صعب
1471,دخل جنة اتت جنة أبصر قصر فقل لمن قال خطب أرد دخل فلم منع علم بغر عمر خطب بأب وأم نبي وعل اغر,197,67,Wedlock; Marriage (Nikaah) - كتاب النكاح,سهل
1472,بين نئم رأت جنة مرأ وضأ جنب قصر فقل لمن ذكر غير فول دبر بكى عمر جلس وعل اغر,184,67,Wedlock; Marriage (Nikaah) - كتاب النكاح,سهل
1473,أعلم كنت رضي كنت غضبى فقل عرف كنت رضي فإن تقل ورب حمد كنت غضبى ورب راهيم ولل هجر اسم,232,67,Wedlock; Marriage (Nikaah) - كتاب النكاح,سهل
1474,غرت مرأ رسل غرت خدج كثر ذكر ثنئ عليها اوح بشر ببت جنة قصب,204,67,Wedlock; Marriage (Nikaah) - كتاب النكاح,سهل
1475,نبر بني هشم غير أذن نكح ابن علي ابي طلب اذن اذن اذن يرد ابي طلب طلق ابن نكح ابن فإن بضع مني يرب ارب يؤذ اذا,281,67,Wedlock; Marriage (Nikaah) - كتاب النكاح,سهل
1476,عبد عمر طلق مرأ وهى حئض عهد سأل عمر خطب مره رجع يمس طهر تحض طهر شاء امس شاء طلق يمس فتل عدة امر طلق نسء,331,68,Divorce - كتاب الطلاق,صعب
1477,طلق عمر مرأ وهى حئض ذكر عمر نبي رجع حسب فمه وعن قتد ونس جبر عمر مره رجع حسب ارأ عجز حمق,220,68,Divorce - كتاب الطلاق,صعب
1478,وزع سأل زهر زوج نبي عاذ عرة عئش ابن جون دخل ودن اعذ بلل منك عذت عظم حقي أهل عبد روه حجج ابي نيع جده زهر عرة خبر عئش,340,68,Divorce - كتاب الطلاق,سهل
1479,خرج نبي طلق حئط يقل شوط نهي حئط جلس بين نبي جلس دخل اتي جون أنزل بيت نخل بيت ميم نعم شراحيل ومع ديت حضن فلم دخل عليها نبي هبي نفس وهل تهب لكة نفس سوق أهى بيد يضع يده عليها لتس فقل اعذ بلل منك عذت عاذ خرج علي اسد اكس رزق ألحق أهل,526,68,Divorce - كتاب الطلاق,صعب
1480,تزج نبي ميم شراحيل فلم دخل بسط يده الي فكأ كره أمر اسد جهز كسو ثوب رزق,142,68,Divorce - كتاب الطلاق,سهل
1481,لبن عمر رجل طلق مرأ وهى حئض عرف عمر عمر طلق مرأ وهى حئض أتى عمر نبي ذكر أمر رجع طهر أرد طلق طلق فهل عد طلق ارأ عجز حمق,236,68,Divorce - كتاب الطلاق,سهل
1482,عويمر عجل جاء عصم عدي صار عصم ارأ رجل مرأ رجل قتل فتقتلونه فعل سل عصم سأل عصم فكر سئل وعب كبر عصم سمع فلم عصم اهل جاء عويمر عصم عصم تأت بخر كره سأل سأل عويمر ولل نهي سأل أقبل عويمر اتى وسط ناس ارأ رجل مرأ رجل قتل فتقتلونه فعل نزل فيك وفي صحب ذهب فأت سهل تلع وأن ناس فلم فرغ عويمر كذب عليها امس طلق ثلث أمر شهب فكن سنة تلع,983,68,Divorce - كتاب الطلاق,صعب
1483,عرة زبر عئش خبر مرأ رفع قرظ جءت فقل رفع طلق فبت طلق وإن نكح بعد عبد رحم زبر قرظ معه هدب لعل ترد رجع رفع يذق عسل تذق عسل,322,68,Divorce - كتاب الطلاق,صعب
1484,ؤمن هجر نبي محن بقل على امن جاء ؤمن هجر تحنو اخر اية عئش اقر بهذا شرط ؤمن فقد اقر حنة فكان قرر بذل قول طلق فقد بيع ولل مست يد يد مرأ بيع كلم ولل نسء امر علي بيع,538,68,Divorce - كتاب الطلاق,صعب
1485,الى نسه وكانت فكت رجل أقم شرب تسع عشر نزل فقل الت شهر شهر عشر,163,68,Divorce - كتاب الطلاق,صعب
1486,عمر يلء سمى يحل أحد اجل يمس عرف عزم طلق امر عز وجل,144,68,Divorce - كتاب الطلاق,سهل
1487,مضت شهر وقف طلق يقع طلق طلق ذكر عثم وعل وأب درداء وعش ثنى رجل صحب نبي,161,68,Divorce - كتاب الطلاق,سهل
1488,نبي سئل ضلة غنم خذه فإن لأخ ذئب سئل ضلة ابل غضب حمر وجن وقل وله عها حذء سقء شرب ماء أكل شجر يلق ربه سئل لقط عرف وكء عفص عرف سنة جاء عرف وإل خلط بمل سفي فلق ربع ابي عبد رحم سفي ولم حفظ شيئ فقل ارأ حدث يزد ولى بعث امر ضلة زيد خلد يحى يقل ربع يزد ولى بعث زيد خلد سفي فلق ربع فقل,576,68,Divorce - كتاب الطلاق,صعب
1489,طاف بعر اتى ركن اشر اله كبر,86,68,Divorce - كتاب الطلاق,سهل
1490,فتح ردم أجج أجج عقد,55,68,Divorce - كتاب الطلاق,سهل
1491,جمع سعة يفق سلم قئم يصل سأل خير عطه وقل بيد وضع ملت بطن سطى خنصر قلن زهد,142,68,Divorce - كتاب الطلاق,سهل
1492,يهد عهد جري أخذ وضح عليها رضخ رأس أتى اهل وهى اخر رمق اصم قتل لغر قتل أشر رأس رجل اخر قتل أشر ففل قتل أشر أمر رضخ رأس حجر,415,68,Divorce - كتاب الطلاق,صعب
1493,نفق سلم نفق اهل حسب صدق,66,69,Supporting the Family - كتاب النفقات,سهل
1494,نفق ادم نفق,45,69,Supporting the Family - كتاب النفقات,سهل
1495,سعي رمل مسك جهد سبل قئم ليل صئم نهر,90,69,Supporting the Family - كتاب النفقات,سهل
1496,نبي يعد وأن ريض بمك فقل مال اوص بمل كله شطر ثلث ثلث ثلث كثر تدع ورث غنياء خير تدع علة كفف ناس ايد ومه فقت فهو صدق لقم رفع مرأ لعل رفع نفع ناس يضر اخر,338,69,Supporting the Family - كتاب النفقات,صعب
1497,فضل صدق غنى الد علا خير الد فلى بدأ تعل تقل رأة طعم وإم طلق يقل عبد طعم عمل يقل ابن طعم تدع فقل هرر كيس ابي هرر,285,69,Supporting the Family - كتاب النفقات,صعب
1498,خير صدق ظهر غنى بدأ تعل,54,69,Supporting the Family - كتاب النفقات,سهل
1499,عمر ثور رجل جمع أهل قوت سنت سنة عمر فلم حضر ذكر حدث حدث شهب زهر الك اوس عمر نبي يبع نخل بني نضر حبس أهل قوت سنت,247,69,Supporting the Family - كتاب النفقات,سهل
1500,الك اوس حدث حمد جبر طعم ذكر ذكر حدث طلق دخل الك اوس سأل الك طلق دخل عمر اته حجب يرف عثم عبد رحم زبر سعد سأذ فأذ دخل سلم جلس لبث يرف قلل علي عبس فأذ فلم دخل سلم جلس عبس امر ؤمن اقض بين وبين رهط عثم أصحاب امر ؤمن اقض بين أرح احد اخر عمر تئد نشد بلل تقم سمء ارض علم ورث ترك صدق يرد نفس رهط أقبل عمر علي عبس شدك بلل علم قلا عمر فإن حدث امر خص رسل مال شىء يعط احد غير افء رسل نهم فما وجف خيل قول قدر فكن خلص رسل ولل حاز دون أثر علي عطاكمو وبث يكم بقي مال فكان نفق اهل نفق سنت مال أخذ بقي جعل جعل مال عمل بذل حيت نشد بلل علم قال لعل عبس شدك بلل علم قلا وفى نبه بكر ولي قبض بكر عمل عمل وأن حينئذ أقبل علي عبس زعم بكر وكذ ولل علم صدق بار رشد تبع لحق وفى بكر فقل ولي وأب بكر قبض سنت عمل عمل أبو بكر جئتم كلم وحد أمر جئت سأل نصب اخك أتى سأل نصب مرأ ابي فقل شئت دفع علك عهد يثق عمل عمل وبم عمل بكر وبم عمل ولت وإل كلم فقل دفع الي بذل دفع بذل نشد بلل دفع اله بذل رهط أقبل علي عبس شدك بلل دفع بذل قلا لمس مني قضء فلذ بإذ تقم سمء ارض اقض قضء تقم سعة عجز دفع فأن كفيكم,2435,69,Supporting the Family - كتاب النفقات,صعب
1501,جءت هند عتب فقل سفي رجل سيك فهل حرج عيل عرف,128,69,Supporting the Family - كتاب النفقات,سهل
1502,فقت رأة كسب زوج امر فله نصف اجر,65,69,Supporting the Family - كتاب النفقات,سهل
1503,فطم عله سلم اتت نبي شكو اله لقى يده رحى بلغ جءه رقق فلم صدف ذكر لعش فلم جاء خبر عئش فجء اخذ ضجع ذهب نقم فجء قعد بين وبن وجد برد قدم بطن ادل خير سأل اخذ ضجع اوت فرش سبح ثلث ثلث حمد ثلث ثلث كبر ربع ثلث فهو خير خدم,454,69,Supporting the Family - كتاب النفقات,صعب
1504,فطم عليها سلم اتت نبي سأل خاد خبر خير سبح نمك ثلث ثلث حمد ثلث ثلث كبر ربع ثلث سفي احد ثلث فما ترك قيل ليل صفن ليل صفن,286,69,Supporting the Family - كتاب النفقات,صعب
1505,اسد يزد سأل عئش نبي صنع بيت هنة اهل سمع اذن خرج,135,69,Supporting the Family - كتاب النفقات,سهل
1506,هند عتب سفي رجل شحح وليس يعط يكف ولد اخذ علم خذي يكف ولد عرف,158,69,Supporting the Family - كتاب النفقات,سهل
1507,خير نسء ركب ابل نسء قرش وقل اخر صلح نسء قرش حنه ولد صغر أرع زوج يده,115,69,Supporting the Family - كتاب النفقات,صعب
1508,اتى نبي حلة يرء لبس فرأ غضب وجه شقق نسي,92,69,Supporting the Family - كتاب النفقات,صعب
1509,هلك ابي وتر بنت بنت تزج مرأ ثيب تزج جبر فقل بكر ثيب ثيب فهل جري لعب لعب تضح تضح فقل عبد هلك وتر بنت وإن كره اجئ مثل تزج مرأ تقم علي صلح برك خير,375,69,Supporting the Family - كتاب النفقات,صعب
